Proposed_Label,Clean_Title,SO_Link
Errors,get alignment two different tokenizations eg bert vs spacy,https://stackoverflow.com/questions/59497734
Errors,extract datesplaces text,https://stackoverflow.com/questions/19692176
Implementation,nlp getting common pos tag word using dictionary training data,https://stackoverflow.com/questions/52808220
Implementation,meaning gold sentiment distribution,https://stackoverflow.com/questions/54338964
Model Training,writing models opennlp,https://stackoverflow.com/questions/24381095
Model Training,unable finetune deberta,https://stackoverflow.com/questions/74145203
Text Preprocessing,check remaining words applying tfidfvectorizer python,https://stackoverflow.com/questions/68246383
Text Preprocessing,plot tweets length clear length high values,https://stackoverflow.com/questions/73222676
Tool Usage,extract personal information person list documents summarize,https://stackoverflow.com/questions/55045053
Tool Usage,lstm one line poem generation single word input manipulation model creation,https://stackoverflow.com/questions/77610339
Uncertain,read edit file based values dictionary,https://stackoverflow.com/questions/47427645
Uncertain,import nlp model facebook bart large mnli model julia,https://stackoverflow.com/questions/71456282
Vector Embeddings,add custom prompts llama rag,https://stackoverflow.com/questions/77357935
Vector Embeddings,python bag words nameerror name unicode defined,https://stackoverflow.com/questions/47614742
